{
  "$schema": "https://json-schema.org/draft/2020-12/schema",
  "$id": "urn:quantic-studio:contracts:0.1.0:pv:yield-request",
  "title": "PVYieldRequest",
  "type": "object",
  "additionalProperties": false,
  "required": [
    "schema_version",
    "model_file",
    "execution",
    "weather",
    "solar_position",
    "irradiance_model",
    "dc_model",
    "inverter_model",
    "solar_sampling"
  ],
  "properties": {
    "schema_version": {
      "const": "0.1.0"
    },
    "model_file": {
      "type": "string",
      "minLength": 1
    },
    "execution": {
      "$ref": "urn:quantic-studio:contracts:0.1.0:studies:time-stepped-request"
    },
    "weather": {
      "type": "object",
      "additionalProperties": false,
      "required": [
        "sha256",
        "classification",
        "citation",
        "licence",
        "timezone",
        "calendar",
        "channels",
        "temperature_kind"
      ],
      "properties": {
        "sha256": {
          "type": "string",
          "pattern": "^[a-f0-9]{64}$"
        },
        "classification": {
          "enum": [
            "synthetic",
            "observed"
          ]
        },
        "citation": {
          "type": "string",
          "minLength": 1
        },
        "licence": {
          "type": "string",
          "minLength": 1
        },
        "timezone": {
          "const": "UTC"
        },
        "calendar": {
          "const": "proleptic_gregorian"
        },
        "channels": {
          "type": "object",
          "additionalProperties": false,
          "required": [
            "ghi",
            "dni",
            "dhi",
            "temperature"
          ],
          "properties": {
            "ghi": {
              "type": "string",
              "minLength": 1
            },
            "dni": {
              "type": "string",
              "minLength": 1
            },
            "dhi": {
              "type": "string",
              "minLength": 1
            },
            "temperature": {
              "type": "string",
              "minLength": 1
            }
          }
        },
        "temperature_kind": {
          "enum": [
            "air",
            "cell"
          ]
        }
      }
    },
    "solar_position": {
      "type": "object",
      "additionalProperties": false,
      "required": [
        "model",
        "pressure_pa",
        "air_temperature_c",
        "delta_t_s",
        "atmospheric_refraction_deg"
      ],
      "properties": {
        "model": {
          "const": "nrel_spa"
        },
        "pressure_pa": {
          "type": "number",
          "exclusiveMinimum": 0
        },
        "air_temperature_c": {
          "type": "number"
        },
        "delta_t_s": {
          "type": "number"
        },
        "atmospheric_refraction_deg": {
          "type": "number"
        }
      }
    },
    "irradiance_model": {
      "const": "isotropic"
    },
    "dc_model": {
      "const": "pvwatts_v5"
    },
    "inverter_model": {
      "const": "pvwatts_v5"
    },
    "solar_sampling": {
      "const": "interval_midpoint"
    }
  }
}
